<?xml version="1.0" encoding="UTF-8"?>
<!--
To change this license header, choose License Headers in Project Properties.
To change this template file, choose Tools | Templates
and open the template in the editor.
-->


<personas
    xmlns:xsi='http://www.w3.org/2001/XMLSchema-instance'
    xsi:noNamespaceSchemaLocation='EJERCICIO_4.xsd'>
    <persona puntuacion="23">
        <nombre>Antonio</nombre>
        <apellido>Garrido</apellido>
        <fechanacimiento>2000-02-10</fechanacimiento>
        <numerodocumento>21212121</numerodocumento>
        <trianero barrio="Zarzaquemada">1</trianero>
    </persona>
    <persona puntuacion="13">
        <nombre>Martin</nombre>
        <apellido>Perez</apellido>
        <fechanacimiento>2000-01-24</fechanacimiento>
        <numerodocumento>41141</numerodocumento>
        <trianero barrio="Leganes">0</trianero>
    </persona>
    <persona puntuacion="14">
        <nombre>Ivan</nombre>
        <apellido>Lopez</apellido>
        <fechanacimiento>1991-12-23</fechanacimiento>
        <numerodocumento>2341211</numerodocumento>
        <trianero barrio="Aluche">1</trianero>
    </persona>

</personas>
